,idx,lang,1,2,3,-1,-5,-2
0,sq,Albanian,Ju keni një nivel të ulët të ardhurash.,Ju keni një nivel të ardhurash mesatar.,Ju keni një nivel të lartë të ardhurash.,,,
1,am,Amharic,እርስዎ ዝቅተኛ የገቢ ደረጃ አለዎት።,እርስዎ መካከለኛ የገቢ ደረጃ አላችሁ።,እርስዎ ከፍተኛ የገቢ ደረጃ አለዎት።,,,
2,ar,Arabic,لديك مستوى دخل منخفض.,لديك مستوى دخل متوسط.,لديك مستوى دخل مرتفع.,,,
3,hy,Armenian (Hayeren),Դուք ունեք ցածր եկամուտի մակարդակ։,Դուք ունեք միջին եկամուտի մակարդակ:,Դուք բարձր եկամուտ ունեք։,,,
4,az,Azerbaijani (Azeri),Sizin gəlir səviyyəniz aşağıdır.,Sizin orta gəlir səviyyəniz var.,Sizin yüksək gəlir səviyyəniz var.,,,
5,eu,Basque,Zure diru-sarrera maila baxua da.,Zure diru-sarrera maila ertaina da.,Diru-sarrera maila altua duzu.,,,
6,bn,Bengali (Bangla),আপনার আয়ের স্তর কম।,আপনার আয়ের স্তর মধ্যম।,আপনার আয় স্তর উচ্চ।,,,
7,bik,Bikol (Bicolano),Ika may mababa na kita.,Ika may medyo na kita na income.,Ika may dakulang kita.,,,
8,bs,Bosnian,Imate nizak nivo prihoda.,Imate srednji nivo prihoda.,Imate visok nivo prihoda.,,,
9,bg,Bulgarian,Имате ниско ниво на доходите.,Имате средно ниво на доходи.,Имате високо ниво на доходи.,,,
10,my,Burmese,သင့်ဝင်ငွေအဆင့်မှာ နိမ့်ပါသည်။,သင့်ဝင်ငွေအဆင့်မှာ အလယ်အလတ်ဖြစ်ပါတယ်။,သင်၏ဝင်ငွေအဆင့်မှာ မြင့်မားပါသည်။,,,
11,ca,Catalan (Valencian),Tens un nivell d'ingressos baix.,Tens un nivell d'ingressos mitjà.,Tens un alt nivell d'ingressos.,,,
12,ceb,"Cebuano (Bisaya, Binisaya)",Aduna kay ubos nga kita.,Aduna kay kasarangan nga lebel sa kita.,Aduna kay taas nga lebel sa kita.,,,
13,hr,Croatian,Imate nisku razinu prihoda.,Imate srednju razinu prihoda.,Imate visoku razinu prihoda.,,,
14,cs,Czech,Máte nízkou úroveň příjmu.,Máte střední úroveň příjmu.,Máte vysokou úroveň příjmu.,,,
15,da,Danish,Du har et lavt indkomstniveau.,Du har et mellemindkomstniveau.,Du har et højt indkomstniveau.,,,
16,nl,Dutch (Flemish),Je hebt een laag inkomensniveau.,Je hebt een gemiddeld inkomensniveau.,U heeft een hoog inkomensniveau.,,,
17,en,English,You have a low income level.,You have a medium income level.,You have a high income level.,,,
18,es,Spanish (Castilian),Tienes un nivel de ingresos bajo.,Tienes un nivel de ingresos medio.,Tienes un alto nivel de ingresos.,,,
19,et,Estonian,Sul on madal sissetulek.,Sul on keskmine sissetulek.,Teil on kõrge sissetulek.,,,
20,fil,Filipino (Pilipino),Mababa ang iyong antas ng kita.,Mayroon kang katamtamang antas ng kita.,Ikaw ay may mataas na antas ng kita.,,,
21,fi,Finnish,Sinulla on matala tulotaso.,Sinulla on keskituloinen tulotaso.,Sinulla on korkea tulotaso.,,,
22,fr,French,Vous avez un faible niveau de revenu.,Vous avez un revenu moyen.,Vous avez un niveau de revenu élevé.,,,
23,gl,Galician,Tes un nivel de ingresos baixo.,Tes un nivel de ingresos medio.,Tes un nivel de ingresos alto.,,,
24,ka,Georgian,თქვენ გაქვთ დაბალი შემოსავლის დონე.,თქვენ გაქვთ საშუალო შემოსავლის დონე.,თქვენ გაქვთ მაღალი შემოსავლის დონე.,,,
25,de,German,Sie haben ein niedriges Einkommensniveau.,Sie haben ein mittleres Einkommensniveau.,Sie haben ein hohes Einkommensniveau.,,,
26,el,"Greek, Modern",Έχετε χαμηλό επίπεδο εισοδήματος.,Έχετε μεσαίο επίπεδο εισοδήματος.,Έχετε υψηλό επίπεδο εισοδήματος.,,,
27,ha,Hausa,"Ga abin da aka fassara zuwa Hausa: ""Kana da karamin matakin samun kudin shiga.""",Kana da matsakaicin matakin samun kudin shiga.,Kana da babban matakin samun kudin shiga.,,,
28,hil,Hiligaynon (Ilonggo),May ara ka sang nubo nga kita.,Ikaw may medium nga lebel sang kita.,May ara ka sang mataas nga kita.,,,
29,hi,Hindi,आपकी आय का स्तर कम है।,आपकी आय स्तर मध्यम है।,आपकी आय का स्तर उच्च है।,,,
30,hu,Hungarian,Alacsony jövedelmi szinten van.,Önnek közepes jövedelmi szintje van.,Magas jövedelmi szinten vagy.,,,
31,is,Icelandic,Þú hefur lágar tekjur.,Þú hefur meðaltekjur.,Þú hefur háar tekjur.,,,
32,ig,Igbo,Ị nwere ọkwa ego ntakịrị.,Ị nwere ọkwa ego etiti.,Ị nwere ọkwa ego mbata dị elu.,,,
33,ilo,"Ilocano (Ilokano, Iloko)",Adda ka iti bassit a lebel ti pagtaudan ti kuarta.,Adda ka iti tungtungan nga kita ti income.,Adda kangato a lebel ti pagtaudan ti kuarta.,,,
34,id,Indonesian,Anda memiliki tingkat pendapatan yang rendah.,Anda memiliki tingkat pendapatan menengah.,Anda memiliki tingkat pendapatan yang tinggi.,,,
35,it,Italian,Hai un basso livello di reddito.,Hai un reddito medio.,Hai un reddito elevato.,,,
36,ja,Japanese,あなたの収入は低いです。,あなたの収入は中程度です。,あなたは高い収入レベルです。,,,
37,kk,Kazakh,Сіздің табыс деңгейіңіз төмен.,Сіздің табыс деңгейіңіз орташа.,Сіздің табыс деңгейіңіз жоғары.,,,
38,ky,Kirghiz (Kyrgyz),Сиздин киреше деңгээлиңиз төмөн.,Сиздин киреше деңгээлиңиз орточо.,Сиздин киреше деңгээлиңиз жогору.,,,
39,zh,Chinese,您的收入水平较低。,您的收入水平属于中等。,您的收入水平很高。,,,
40,ko,Korean,귀하는 소득 수준이 낮습니다.,당신은 중간 소득 수준입니다.,당신은 높은 소득 수준을 가지고 있습니다.,,,
41,lt,Macedonian,Вашето ниво на приходи е ниско.,Имате средно ниво на приход.,Имате висок приход.,,,
42,mk,Malay (Malaysian),Anda mempunyai tahap pendapatan yang rendah.,Anda mempunyai tahap pendapatan sederhana.,Anda mempunyai tahap pendapatan yang tinggi.,,,
43,ms,"Standart Chinese (Mandarin, Putonghua, Guoyu)",你的收入水平较低。,你的收入水平属于中等。,你的收入水平很高。,,,
44,mn,Mongolian,Таны орлого бага байна.,Таны орлого дундаж түвшинд байна.,Таны орлогын түвшин өндөр байна.,,,
45,cnr,Montenegrin,Vaš nivo prihoda je nizak.,Imate srednji nivo prihoda.,Imate visok nivo prihoda.,,,
46,nd,North Ndebele,Unemali encane engenayo.,Unalo umholo ophakathi.,Unemali enengi.,,,
47,no,Norwegian,Du har et lavt inntektsnivå.,Du har et middels inntektsnivå.,Du har et høyt inntektsnivå.,,,
48,om,Oromo,"""Sadarkaa galii xiqqaa qabda.""","""Qabeenya giddu galeessaa qabda.""","""Qabeenya galii ol'aanaa qabda.""",,,
49,fa,"Persian (Farsi, Dari)",شما درآمد پایینی دارید.,شما دارای سطح درآمد متوسطی هستید.,شما درآمد بالایی دارید.,,,
50,pl,Polish,Masz niski poziom dochodów.,Masz średni poziom dochodów.,Masz wysoki poziom dochodów.,,,
51,pt,Portuguese,Você tem um nível de renda baixo.,Você tem um nível de renda médio.,Você tem um alto nível de renda.,,,
52,ro,"Romanian (Moldavian, Moldovan)",Aveți un nivel scăzut de venituri.,Aveți un nivel mediu de venit.,Aveți un nivel ridicat de venituri.,,,
53,ru,Russian,У вас низкий уровень дохода.,У вас средний уровень дохода.,У вас высокий уровень дохода.,,,
54,sr,Serbian,Imate nizak nivo prihoda.,Imate srednji nivo prihoda.,Imate visok nivo prihoda.,,,
55,sn,Shona,Une mari shoma yaunowana.,Une mari yepakati.,Une mari yakawanda yaunowana.,,,
56,sk,Slovak,Máte nízku úroveň príjmu.,Máte strednú úroveň príjmu.,Máte vysokú úroveň príjmu.,,,
57,sl,Slovenian,Vaš dohodek je nizek.,Vaš dohodek je srednje ravni.,Imate visoko raven dohodka.,,,
58,sw,Swahili,Una kipato cha chini.,Una kipato cha kati.,Una kiwango cha juu cha mapato.,,,
59,sv,Swedish,Du har en låg inkomstnivå.,Du har en medelinkomstnivå.,Du har en hög inkomstnivå.,,,
60,tg,Tajik,Шумо сатҳи даромади паст доред.,Шумо сатҳи миёнаи даромад доред.,Шумо сатҳи баланди даромад доред.,,,
61,tsg,Tausug,Mababa in kaulan sin kitaun mu.,"In Tausug, the translation would be: ""Ikaw mayta mahap taud-taud in kita.""","In Tausug, you can translate ""You have a high income level"" as ""Mataas in kaantanan han imo kitaan.""",,,
62,th,Thai (Central Thai),คุณมีรายได้ต่ำ,คุณมีรายได้ในระดับปานกลาง,คุณมีรายได้สูง,,,
63,tig,Tigre,ንስኻ ንብሩህ ደረጃ ዚኽፈል ኢኻ።,ንስኻ ማእኸላይ ደረጃ ወዲእካ ኣለካ።,ነርከት ዝለዓለ ደሞጽ ኣሎካ።,,,
64,uk,Ukrainian,У вас низький рівень доходу.,У вас середній рівень доходу.,У вас високий рівень доходу.,,,
65,tr,Turkish,Gelir seviyeniz düşük.,Orta gelir seviyesine sahipsiniz.,Yüksek bir gelir seviyeniz var.,,,
66,ur,Urdu,آپ کی آمدنی کی سطح کم ہے۔,آپ کی آمدنی کی سطح درمیانی ہے۔,آپ کی آمدنی کی سطح بلند ہے۔,,,
67,uz,Uzbek,Sizning daromad darajangiz past.,Sizning daromad darajangiz o'rtacha.,Sizning daromad darajangiz yuqori.,,,
68,vi,Vietnamese,Bạn có mức thu nhập thấp.,Bạn có mức thu nhập trung bình.,Bạn có mức thu nhập cao.,,,
69,war,Waray,Mayda ka ubos nga lebel han kita.,May-ada ka hin medyo nga kita.,May-ada ka hitaas nga lebel han kita.,,,
70,yo,Yoruba,O ni ipele owo-wiwọle kekere.,O ni ipele owo-wiwọle alabọde.,O ni ipele owo-wiwọle giga.,,,
